name,url,title,description,keywords,seoImg,ShareText,shortTitle
home,/,Día Internacional de la Mujer,Un especial de eldiario.es sobre igualdad y género,"Mujer, derechos, 8 marzo, feminismo",home-seo.jpg,ESPECIAL | Día Internacional de la Mujer #8marzo vía @eldiarioes ,Día Internacional de la Mujer
mileva,/mileva-maric/,"Mileva Maric, ¿madre olvidada de la Teoría de la Relatividad?","El debate sobre qué papel jugó la matemática serbia Mileva Maric, primera mujer de Einstein, en los trabajos por los que él recibió el Premio Nobel continúa sobre la mesa desde la publicación de las cartas dirigidas en las que el científico más popular del siglo XX discutía con ella de asuntos científicos y hablaba de “nuestro trabajo” y “nuestra investigación”. ","Mileva, Einstein, mujer, Premio Nobel, matemática, relatividad, Teoría",mileva-seo.jpg,"REPORTAJE | Mileva Maric, ¿madre olvidada de la Teoría de la Relatividad? vía @eldiarioes #8marzo","Mileva Maric, ¿madre olvidada de la Teoría de la Relatividad?"
salud,/salud/,La salud también es una cuestión de género,"Según la OMS, un 50% de las mujeres del mundo padecen un acceso diferente y desigual a los tratamientos primarios de salud. “Las mujeres viven más años que los hombres, pero lo hacen con peor salud percibida y con más trastornos crónicos” afirma Carme Borrell, doctora en salud pública.","oms, salud, hospital, desigualdad, enfermedad, mujer, mundo, medicina, médico",salud-seo.jpg,REPORTAJE | La salud también es una cuestión de género vía @eldiarioes #8marzo,La salud también es una cuestión de género
educacion,/educacion/,"La educación en igualdad, la gran ausente en los colegios españoles","Desde que el ministro Wert eliminó Educación para la Ciudadanía, la formación en igualdad depende de la voluntad de los colegios e institutos.","wert, educación, igualdad, colegios, españa, igualdad, institutos",educacion-seo.jpg,"REPORTAJE | La educación en igualdad, la gran ausente en los colegios españoles vía @eldiarioes #8marzo","La educación en igualdad, la gran ausente en los colegios españoles"
acoso,/acoso/,El acoso machista al que te enfrentas si te atreves a hablar de feminismo en redes,"Ser ciberfeminista y lidiar casi diariamente con amenazas, comentarios vinculados al físico o insultos sexistas es casi inevitable.","amenazas, pikara, insultos, comentarios, twitter, feminismo, feminista",ciberacoso-seo.jpg,REPORTAJE | El acoso machista al que te enfrentas si te atreves a hablar de feminismo en redes vía @eldiarioes #8marzo,El acoso machista al que te enfrentas si te atreves a hablar de feminismo en redes
economia,/economia/,La evolución socioeconómica de la mujer: una película a cámara (muy) lenta,"La incorporación de la mujer ha aumentado en el mercado laboral pero sin avances significativos en la brecha salarial. En la Unión Europea, las mujeres cobran un 16% menos por hora trabajada por la menor presencia en puestos de dirección y la presencia masiva de mujeres en sectores menos cualificados.","datos, mujer, trabajadora, salario, brecha salarial, condiciones laborales, Ibex35, mercado laboral",datos-seo.jpg,DATOS | La evolución socioeconómica de la mujer: una película a cámara (muy) lenta vía @eldiarioes #8marzo,La evolución socioeconómica de la mujer: una película a cámara (muy) lenta
libros,/libros/,Celebra el día de la mujer leyendo libros escritos y protagonizados por mujeres excepcionales,"Esta pequeña selección no es de libros feministas, sino cinco novedades literarias escritas con especial destreza que reflexionan sobre el estado, condición y vicisitudes de la mujer contemporánea.","libros, cultura, mujer, protagonista, feminismo, literatura",peirano-seo.jpg,Celebra el día de la mujer leyendo libros escritos y protagonizados por mujeres excepcionales vía @eldiarioes #8marzo,Celebra el día de la mujer leyendo libros escritos y protagonizados por mujeres excepcionales
mapa,/mapa/,"Una mujer, un país, una lucha","La experiencia de mujeres que se negaron a resignarse ante una injusticia, una tragedia o la tradición de sus países: Amani Yahya, en Yemen; Caddy Adzuba, en República Democrática del Congo; Soraya Post, en Suecia; y Kakenya Ntaiya, en Kenia.","Desalambre, mapa, mujeres, mundo, tradición, injusticia, país, lucha",mapa-seo.jpg,"MAPA | Una mujer, un país, una lucha vía @eldiarioes #8marzo","Una mujer, un país, una lucha"
rosa,/tasa-rosa/,La tasa rosa o por qué los productos para mujeres son más caros,"La llamada tasa rosa provoca que muchos de los productos y servicios pensados para las mujeres cuesten más que los dirigidos a hombres. cuchillas, crema depilatoria, champú...Todo más caro si es para ellas.","tasa rosa, supermercado, precios, mujeres, gasto, caro, cuchillas, crema depilatoria, champú, juguetes, rosa",video-seo.jpg,VÍDEO | La tasa rosa o por qué los productos para mujeres son más caros vía @eldiarioes #8marzo,La tasa rosa o por qué los productos para mujeres son más caros